{
  "$schema": "./scripts/boundaries/boundaries.schema.json",
  "clientSafeEntrypoints": {
    "@repo/api": ["./client", "./contract", "./errors"],
    "@repo/auth": ["./client"],
    "@repo/database": [],
    "@repo/jobs": [],
    "@repo/mail": [],
    "@repo/storage": []
  },
  "forbiddenImportExceptions": {},
  "forbiddenPackageImports": {},
  "packageRules": {
    "@repo/access-control": [],
    "@repo/analytics": [],
    "@repo/api": [
      "@repo/access-control",
      "@repo/auth",
      "@repo/config",
      "@repo/database",
      "@repo/jobs",
      "@repo/logger",
      "@repo/mail",
      "@repo/security",
      "@repo/storage"
    ],
    "@repo/auth": [
      "@repo/access-control",
      "@repo/config",
      "@repo/database",
      "@repo/logger",
      "@repo/mail"
    ],
    "@repo/billing": [],
    "@repo/cms": [],
    "@repo/config": ["@repo/helpers", "@repo/i18n"],
    "@repo/database": ["@repo/access-control"],
    "@repo/design-system": ["@repo/config", "@repo/helpers", "@repo/i18n"],
    "@repo/flags": [],
    "@repo/helpers": [],
    "@repo/i18n": [],
    "@repo/jobs": [],
    "@repo/logger": [],
    "@repo/mail": ["@repo/logger"],
    "@repo/observability": [],
    "@repo/security": [],
    "@repo/storage": [],
    "@repo/test": [],
    "@repo/typescript-config": []
  }
}
